review_id,drugName,condition,review,rating,date,usefulCount
100010,Desogestrel / ethinyl estradiol,Birth Control,"First month was absolutely horrible. This is my first birth control pill. The nausea seemed to occur 2 hrs after taking the pill (I take it at 3pm everyday). I was also unmotivated and felt like my back ached all the time. Then it got better. I don't get headaches anymore. But looking back, I definitely gained weight, like A LOT. I didn't lose my sex drive. Anyway, I'm okay now.",7.0,2017-06-20,1
26542,Sprintec,Birth Control,"I've been on Sprintec for going on 2 years and the longer I've been on it the more I've noticed that my sex drive is beyond low. My fiance' and I used to have sex regularly at least 2-3 times a week and now it has gone down to once a month. Neither of us are okay with that, and I cannot help but wonder if it is from Sprintec. When I first started this pill I thought it was great and I have no other complaints other than the low sex drive, I am thinking about switching soon!",9.0,2013-01-27,16
78346,Lyza,Birth Control,"I had just about given up on ever thinking I could be on a hormonal form of contraception. I had tried two other forms of birth control in the past, the first being Yaz which was the WORST thing ever. I swore off birth control for years thinking my body just couldn't handle it. I recently went back to my OBGYN just to see if there were ANY other last resort options for pills. She recomended Lyza becuase its low hormones, and I was hesitant at first but gave it a go. I have been on Lyza for almost a month now, I have had almost no spotting, no mood swings, no headaches, no troubles with blood clots/wheezing, nothing like my other experiences! Thank you Lyza!!! You literally saved the day, and hopefully everything continues to be awesome!",10.0,2016-05-04,13
10128,Lo Loestrin Fe,Birth Control,"One month report - I had constant small bleeding for full month - now on month 2 and thinking I will not have any period. I plan to give the pill a full 3 months. But wanted to comment about continuous bleeding for first month, enough that you would need a pad or small tampon only. One side effect is I am having some constipation but increasing my water to help this. I will update my status after month 2.",8.0,2011-10-07,9
33808,Junel Fe 1 / 20,Birth Control,"The reviews I've seen aren't the most accurate. Of course everyone is different, but this works for me. I was originally on Gildess (same dosage) and LOVED it. Yet, it was discontinued and I was put on Blisovi - which was literally the worst BC I've ever been on. I talked to my pharmacist and was switched to this. If Gildess worked for you, this is the next best thing. Good luck!",8.0,2017-04-25,10
16585,Ethinyl estradiol / norethindrone,Birth Control,I have tried every birth control pill out there...I was reluctant to try lolo Glad I did however! It's the ONLY pill that didn't give me side effects and I could take in the morning. Slight breakthrough bleeding every now and then for the first two months but other than that it's the best one yet!,9.0,2015-11-23,5
138025,Ortho Evra,Birth Control,"Very easy to use, doesn't give me morning sickness like the pill did. I don't even notice its on. Only downfall is that it falls off in the shower or pool, and I think its causing me to gain weight. It also made me very moody for the first 3 months.",7.0,2015-04-16,3
166366,Levonorgestrel,Birth Control,"I got Liletta placed in 2 days ago and while the insertion process wasn't comfortable at all, I only had cramps the day of insertion and haven't had any since. My doctor said I would have a period 4-6 weeks but I stopped this morning, only 2 days later, so overall I would say that I like this IUD but I will update in a month to tell if it has gotten better or worse.",10.0,2016-11-25,3
109632,Nexplanon,Birth Control,"I just had my second Nexplanon inserted in August 2016. Overall it's been great. When I got the first one done I only got my period about every 3 months, but it became more regular in the third year. Now with the second one inserted, my period hasn't shown up yet and probably won't for a few months. The only negative side effects I have experienced are some minor weight gain (although I have experienced weight gain on every birth control I've tried) and considerable breast pain a few days before I start my period.",9.0,2016-09-13,0
121123,Venlafaxine,Depression,"Been on Effexor for fourteen years. It makes Ocd worse and PTSD worse and my depression worse. I don't care what these negative reviews say, I am switching from this crap drug to another antidepressant. I feel fourteen years of my life have been ruined and I was lied to by the medical profession, they never told me how terrible this drug was and how it makes paranoia and OCD and PTSD worse. Oh and I can't eat oats or wheat or cheese or margarine or butter as it gives me drowsiness and unbeatable tiredness.Effexor should be banned, its ruined my life and I can't wait to come off it and go on another drug.",1.0,2016-12-12,13
6567,Wellbutrin XL,Depression,"I've been taking this generic bupropion XL 300 mg for a little over a year now. I was prescribed this for depression and an anti-smoking aid but it has no effect on stopping the desires of me wanting to have cigarettes. It's not helping with my depression. I feel sluggish and tired all day. Depression almost seems worse the days I do take it versus when I don't. sex drive hasn't been this low since like ""ever""!. I'm probably going to discontinue it. If it's not helping it can only be hurting right? I can only get what the doctors are willing to prescribe me, but most the time it's garbage. I'm prescribed hydroxizine for sleep & anxiety. Thats garbage too, but whole dif story.",1.0,2016-09-10,23
55936,Effexor,Depression,"I was given Effexor XR for depression. I had the usual side effects at first dizziness, nauseous, weird dreams and tingly. I was able to beat most of these by taking the medication at the same time every night. The down side was if I was late by a few hours taking it the dreams and tingly feeling returned bad. I was started on 75mg and that worked for a few months then the dosage was upped to 150mg. This worked for a few months as well then I hit rock bottom again and the dosage was upped again to 225mg unfortunately this only worked for a few months. A year after this I was given it again this time it only worked for a couple weeks. This was not the medicine for me.",1.0,2010-10-16,23
93401,Vortioxetine,Depression,"I'm extremely sensitive to the side effects of these medicines. Remeron is the only one I can tolerate (and it doesn't give me enough relief by itself). Brintellix's side effects reminded me of Pristiq's--falling asleep during the day, not able to sleep at night but it worked on my Interstitial Cystitis and it reduced my appetite, so I'm going to give it a longer trial in the summer when school is out and I'm not working.",4.0,2014-05-24,46
231315,Trazodone,Depression,Dry mouth,2.0,2017-07-14,8
93143,Vortioxetine,Depression,I'd get a mild headache within fifteen minutes of taking this and the intensity of the pain depended on the dosage.,1.0,2016-01-01,20
163741,Mirtazapine,Depression,"My doctor had me try this after several other current anti-depressants failed. It gave me bad nightmares every night for the three weeks I tried it. The last night I took it, my dog (who sleeps with me) was frantically licking my face to wake me out of my nightmare. That was enough. I then went to an old medicine, imipramine, that has proved effective in controlling my depression and anxiety.",2.0,2012-02-21,33
131729,Effexor XR,Depression,"This was indeed the scariest medication ever. I started it and the first two weeks were too much. I had the normal beginning-taking-New-antidepressant side effects but I'd have hallucinations in the dark. Things would move and sway and melt together. It began to make me numb over the five years I took this medicine. I couldn't ""feel"" anything. All I wanted to do was sleep and sit there and zone out. I felt as though I was in limbo. They tried all doses and absolutely nothing changed. Not only that, I would miss a day and it was a nightmare. Eventually I cut myself off of it in the way the doctor told me to. Scariest experience ever. Worst few weeks of my life. I still had nighttime hallucinations, I felt like I was falling off a skyscraper.",1.0,2015-08-10,34
45526,Fluoxetine,Depression,"I've been on Prozac for just about 3 months. At first I did not notice a difference for about a month then I started feeling more energized for a few weeks however the weight is going on as fast as grass grows. I'm seeing my doctor today and need to switch. I've even been working out, walking and have been more active. The weight gain is awful, at least for me.",4.0,2014-06-17,61
118758,Zoloft,Depression,"I was put on this for depression. The first day I took it, I got extreme fatigue and it took so much willpower to get up and do anything. I just did not want to move. I also got out of breath doing the simplest things, like getting out of my car and standing up. I was a total zombie. These symptoms decreased within a few weeks, but it was awful to get through. In addition, I was 130 lbs. when I began taking it and blew up to 209 lbs. over one year despite not eating more or exercising less. It also didn't help my depression. So in the end it did not help me and I gained 79 lbs. in one year. As soon as I stopped taking it, my weight dropped down to 160 lbs. without doing anything.",1.0,2012-09-13,33
168919,Vilazodone,Depression,"I began taking Viibryd 10mg 3 months ago. Quickly began having stomach pain, worsening of insomnia and diarrhea. Couldn't go up to 20mg because of worsening of side effects. Today, Sept. 1, I took it and again, having uncontrollable diarrhea. Seeing my doctor on the third and am going to ask for a something else. All of the SSRIs and SNRIs have affected my GI track but not as bad as this one. Life long history of depression and anxiety. Searching for the right antidepressant for over 20 years.",1.0,2013-09-01,41
61478,Citalopram,Depression,"I don't understand, I'm new to medicine and 18 years old and taking citalopram. I've done some research, but nothing says anything about being sad. I don't know whats wrong with me. Is this normal for citalopram?",4.0,2017-04-16,7
119020,Zoloft,Depression,"I've been on Zoloft (generic) for a few weeks now. I'm on a low dose (25mg) to get me started. I haven't noticed much of a lift in my mood, in fact I tend to get sad more easily, but I have fewer headaches, which used to be a big problem for me. Also I've noticed it makes me really tired so I take it at night to help me sleep.",3.0,2010-08-12,18
102446,Aripiprazole,Depression,"I was diagnosed with depression in 2000. My doctor at the time was a bit of a quack and had no idea of the symptoms and treatments for depression. Moving forward, I have been seeing a very good doctor now for about 12 years. As you are well aware, not all meds for for all people. I am only writing this today in hopes of saving someone some time and frustration if Abilify is not working for you. I started taking Abilify as an enhancement to the Wellbutrin that I was already taking. As time went on, my depression got worse. To make a long story short, I went off of Abilify 3 months ago and life has been great. Not sleeping all day or dragging my butt, thinking clearer and have endless amounts of energy. STAY AWAY FROM THIS MED!",2.0,2016-10-08,24
168937,Vilazodone,Depression,"Terrible Bloating, cramping diarrhea, brain zaps, irritability, anger and rage.",1.0,2013-01-13,59
185993,Desvenlafaxine,Depression,"I know people react to medication differently, some have had great experience but most have seen the dark side of this medication. I've been on multiple medications, this is definitely the last one I will ever go on. My suicidal thoughts increased to almost daily, felt like self harming my self all the time. super irritable. I was only on the medication for 2 months, before I was on effexor for almost 2 years.. multiple medications before. I decided to wean off of it with the help of the pharmacist for a month.. after officially off of them I have never felt something so horrible as these withdrawal symptoms. so dizzy I couldn't get off out of bed for 4 days, brain zaps, shaking uncontrollably, hit and cold flashes.. ect. BE CAREFUL",1.0,2016-11-21,14
140759,Escitalopram,Depression,"I switched from Effexor to Lexapro after I was beginning to have suicidal thoughts. While my mood improved, my sex drive plummeted. On top of that, I gained 25lbs in a month. After completely changing my diet and exercise routine by suggestion of my doctor, I still hadn't lost any of the weight. It began to chip at what little self esteem I had, and my mood began to plummet again. It's hard to feel happy when you feel so uncomfortable with your body after a rapid weight change. I've been switched to Welbutrin SR, so we'll see how that goes.",3.0,2016-07-12,9
94842,Abilify,Depression,I have taken abilify for one year. It was prescribed as an add on to Cymbalta after a suicide attempt. I feel it boosts my mood. BUT I have gained 35 pounds. I can't imagine continuing on a medication with this side effect. It is not worth it to switch my angst over life circumstances to feeling depressed over a continual weight gain.,3.0,2013-02-19,94
92780,Vortioxetine,Depression,"I sure hope me writing this can help someone avoid the prolonged agony I experienced on Trintellix. I started with a 5 mg dose for one month. After about 5 days, I started having itching on my external vulva. By the 7th day, I almost went to the ER, but by that time, due to all my scratching, I had developed a pseudomonas aeruginos infection. Four courses of antibiotics later, the unbearable, constant, relentless, and ever-present itching was still there, with some hives. Though the infection was gone, the itching continued. I have never had intense itching like this--the more I scratched, the more I itched, and I couldn't even sleep. Two days after stopping Trintillix, the itching was gone. Two months of hell. Fixed drug eruption.",1.0,2017-09-24,28
92790,Vortioxetine,Depression,"My doctor prescribed this medication for my depression. However, it has caused major anxiety and agitation. These two warnings are listed on the Trintellix web page. So be careful! You may be exchanging one problem for another!",1.0,2017-11-25,2
101111,Rexulti,Depression,I started taking this a week ago and since then get very little sleep. I take ambian and Valium at night and it has proved ineffective so for. I'm hoping this is one of those side effects that go with time. It's hard to function when you're awake every two hours.,4.0,2016-06-13,22
171606,Wellbutrin,Depression,"For a short while (about a month) this medication worked alright for me, but after that I started having anger issues and mood swings. I was worse on this medication than I was without it. I've heard a lot of people have great results with it, but it was much more of a detriment than a boon for me.",2.0,2012-01-12,25
32039,Wellbutrin XL,Depression,"Mentally, I had no hallelujah moment. My slow and steady upward climb could be Wellbutrin and/or therapy. I began with 150 XL, moved up to 300 XL, began developing rashes, and so I moved back down to 150 XL. Within a month of taking 150 XL, I had transient weird and sharp pains in my right thumb. It was located just under the thumbnail, in the ""corner"" closest to the palm and the rest of the fingers. It started slowly, and got much worse. It hurt in the morning, after eating, after exercising, and when I was cold (or too hot). I had several MRIs, tumor diagnoses, and surgeries which did not fix the sometimes crippling pain. I stopped taking Wellbutrin recently and the pain has already subsided substantially. The more you know.",3.0,2015-08-18,7
93229,Vortioxetine,Depression,"I have tried just about every medication for depression, and all of them eventually quit working for me. I was on Cymbalta, Ritalin, and Abilify. I was prescribed the Brintellix (started at 10mg. and now on 20mg.) to replace the Cymbalta I was previously on. I am not feeling any better now after being on it for 2 months. I had high hopes, but unfortunately it hasn't done much, if anything for me.",3.0,2015-09-30,37
118886,Zoloft,Depression,I have been on Zoloft for 4 months . I am now at 125mg per day. Depression has slighly improved but not much effect on anxiety and panic attack. Not sleeping better I am dealing with chronic pain and professional burn out. I am thinking about swithching to Pristiq but I am afraid of side effects. I am amazed with the no side effects of Zoloft.,4.0,2012-05-04,13
120927,Venlafaxine,Depression,"I was given this medicine for anxiety and depression, after a month of taking the 37.5mg this medicine has increased my symptoms of anxiety and depression substantially. Also since I have started taking this medication I have developed some new symptoms such as mania and hallucinations. The pains attacks associated with this medicine are horrifying as well. The most disturbing thing about the drug, to me, is the extremely lifelike and vivid dreams that make you believe you've been up all night but in reality you've been asleep, this makes waking up very difficult because it's hard to tell if you're awake or not. This is an extremely powerful drug, I would discuss other options with your doctor before trying Effexor XR",1.0,2017-11-07,4
171441,Wellbutrin,Depression,Didnt work. Hit my anxiety to the max in just 4 days.,1.0,2014-11-03,49
183240,Cymbalta,Depression,"I took this for 5 years at 90mg. I eventually had to go off this medication because the side effects were intolerable. I had night terrors every night, severe night sweats, teeth grinding and insomnia. The thing that finally did it for me was the migraines that were caused by my shoulder and neck tension on this medication. In short, it made me feel extremely anxious and stressed out. Also, withdrawal is very tough. I have been off this medicine for 3 weeks and still have severe nausea, anxiety, night sweats and night terrors.",2.0,2013-03-03,72
45375,Fluoxetine,Depression,"Horrible experience with Prozac! Started taking it on a Thursday, and by Saturday had a buzzing in my ears, a full feeling in my head, and couldn't sleep. On Sunday, I completely lost my appetite, and became very jittery. I was barely able to work on Monday, and called off Tuesday because of generalized anxiety, not sleeping or eating. I ended up taking three total days off of work due to side effects. I literally had to force myself to eat a single slice of toast for breakfast... and barely got it down! I finally went off of it on Wednesday and went back on paxil. By Friday, I am feeling like my old self again. Plus, I had startling dreams. I won't ever take this drug again!",1.0,2015-09-26,21
186242,Desvenlafaxine,Depression,"Fatigue, dry mouth, diarrhea, nausea and insomnia.",2.0,2012-09-09,1
185891,Desvenlafaxine,Depression,SCARIEST ANTI-DEPPRESANT I'VE EVER TRIED! Put me into the stratosphere of anxiety/depression-became suicidal-anything-or nothing is better than this!,1.0,2017-09-04,10
186579,Desvenlafaxine,Depression,I have had the same experience as many. The 50mg worked well but anxiety is now a problem and I have to force myself out of bed. Don't feel like I function well. Love the weight loss but now I have had it combined with Celexa and it is not making me feel buoyant at all. I am not sure if I suffer from ADHD or may have some bipolar... this drug is not the miracle I had hoped for....I have been on it for almost 3 months.,4.0,2010-01-16,14
225936,Bupropion,Depression,"Wellbutrin did not work for me; made me more depressed, joint pain, muscle pain and ringing in ears.",1.0,2009-07-29,30
170200,Quetiapine,Depression,"I've been on this drug for four years, and I will admit, it did help me out at first. I was deeply depressed and going through some major life changing situations. As this calmed down and I developed spiritually, emotionally and mentally, I gradually decreased the dose. I was on 100mg the first year, the second year, 50mg, the third, 25mg, and the fourth, 12.5mg (cutting the 25mg pill in half.) I just got off of it two days ago, and I feel like a new person. I had no idea how much it tampered with my mind. I was in a fog for FOUR YEARS. Although I'm sleep deprived, achy, and irritable from the withdrawals (this med's withdrawals are heinous) I feel better than I have in four years. I do not recommend this drug- save your mind!",2.0,2016-11-21,16
168928,Vilazodone,Depression,"Noticed a great improvement after two days on this medicine. A little restless legs syndrome but not bad then the brain zaps or electrical surges started. It scared me so badly. But I thought it was just due to a short night with little sleep and maybe the half of a beer I had before bed? But this evening, it happened again... Calling the Dr ---Dont think I want to experience these anymore!",3.0,2013-02-02,38
178226,Duloxetine,Depression,"I am a 52 year old male and have been battling depression for 30 years. Back in 1980 tricyclics and MAOI's were the only treatment of choice. Since 1987 when Prozac hit the market I went on that. My depression episodes are brought on by stressful events. Depression also runs in the family. After 5 or 6 different episodes Prozac no longer worked for me. So I tried other SSRI's such as Paxil, Zoloft and lastly Celexa which made me worse. My new physician prescribed Cymbalta which is an SSNRI which I have been on for 4 days at 30 mg and 1 day at 60mg. Prior to starting to take Cymbalta I had suicidal thoughts. In 5 days those thoughts have subsided and have a little more energy. Still have trouble in the morning.",4.0,2010-04-14,33
163719,Mirtazapine,Depression,"Worked well but with terrible side effects--agitation, insomnia, suicidal ideation and constipation. Other side effects too numerous to mention.",4.0,2012-07-10,18
168677,Vilazodone,Depression,"I've been on this drug for 2 days and am already discontinuing use. I got the starter pack and have taken 10mgs each morning for 2 days. It makes me so dizzy and tingly that I can't even move. Very nauseous and drowsy, but I can't sleep because everything is spinning. Not for me.",2.0,2016-03-26,23
179455,Olanzapine,Depression,"Made me sweat in bed while asleep to the point it looked like I had a high fever. Took for depression, made me agitated.",1.0,2009-11-12,31
64496,Sertraline,Depression,I was on zoloft for about 3 months. It caused headaches especially as dosage was increased. Nearly impossible to sleep more than 5 hours. And caused hot flashes and racing thoughts at any dose over 100mg. It also increased my blood pressure. Started helping depression a bit after many helpless weeks but not enough to stay on it satisfactorily.,4.0,2016-06-08,17
122058,Venlafaxine,Depression,"Before taking Effexor XR I was suicidal, crying all the time and very depressed. I have now been on it for 13 years. I love it. I feel ""normal"". only side effects I've had are weight gain and chronic constipation. Due to my insurance not covering it anymore I now have to switch to Zoloft. I sure hope the Zoloft works as good as the Effexor XR did.",10.0,2010-08-22,16
225284,Bupropion,Depression,"I've been on Prozac for about 20 years and it's been a lot of help but at age 68 I found myself wanting to nap a lot more and my motivation decreasing. I switched to Wellbutrin and once the therapeutic dose was established I began to feel better within a week or two. I feel more energetic and yet more composed and at ease. I'm very pleased with this drug, not the least because my sex life has returned. I think my life would have been different if I'd started it 20 years ago.",10.0,2015-06-16,111
225987,Bupropion,Depression,"I was prescribed Wellbutrin XR 300 mg over two years ago. Prior to that, I had tried at least seven other anti-depressants. None of the other drugs helped my depression. I am so grateful for Wellbutrin.",10.0,2009-10-10,39
122349,Selegiline,Depression,"Tried Effexor, Wellbutrin, Paxil, Zoloft in the past with no results. EMSAM has brought me out of it after seven years. Only a little localized skin irritation.",8.0,2010-07-26,51
201669,Zoloft,Depression,"Been on this medicine for 2 months 50 mg, feel so much better and much more relaxed. So much better than Prozac which made me very full of anxiety.",9.0,2014-08-30,134
171716,Wellbutrin,Depression,"I had good results from Wellbutrin. But had a seizure caused by the trauma of a sub-dural hematoma, three brain surgeries, and two craniotomies within 20 days and had to be taken off Wellbutrin because of the seizure risk. The seizure was not contributed by Wellbutrin. Other than the seizure risk Wellbutrin worked well with no side effects.",8.0,2008-12-27,36
28067,Lexapro,Depression,Very good for GAD mixed with depression. I felt worse for 2 months but then felt amazing :) give it a chance,10.0,2015-12-21,63
75667,L-methylfolate,Depression,"I was diagnosed with depression 11 years ago. I can't remember all of the anti-depressants I've been on, but for the last 5 years I've been on Welbutrin 450mg. My psychiatrist prescribed Mirtazapine, for it's energizing effects when on high doses. It didn't work for me; then he prescribed Deplin 15mg. I took it for 6 weeks. I could not tell a huge difference, so I didn't refill my prescription right away. (It's expensive since insurance won't cover it!) After I stopped my energy/motivation decreased, so I started taking it again. I've been on it for about a week now and have seen an increase in my energy again, but the motivation is still not as high as I it should be. Hopefully it will get better the longer I'm on it.",8.0,2012-02-20,85
