review_id,drugName,condition,review,rating,date,usefulCount
42041,Tetracycline,Acne,"Going on tetracycline was a failed attempt at curing my acne. I have mild acne with deep pimples sometimes. The antibiotic did not begin to work until after I was done taking it (I was on it for about 3 months), and it gave me bad stomach pains. After about 2 months of getting off of tetracycline all of my acne came back on my face, and it appeared to be worse on my back and chest. I do not recommend this as a remedy for acne. This was a big waste of time and I regret taking it.",1.0,2017-06-18,3
16103,Ethinyl estradiol / norethindrone,Acne,"I was put on birth control to not only reduce my cystic acne, but to regulate my periods. As far as my actual menstrual cycle goes, everything is normal, if not a little bit better because of this pill. But with my acne, things haven't been going smoothly. If I didn't have a complicated skin care routine I'm positive my face would be covered in acne. When I first got on the pill, my acne did clear up a bit, but eventually I started breaking out even worse than I did prior to being on the pill. To say the least, I'm extremely disappointed. I'm not using the pill for its intended purpose (I'm not sexually active,) yet this was recommended to me anyways??",3.0,2016-05-17,1
60626,Claravis,Acne,"I'm on my second week of Claravis 20mg, 29yrs old. My first week was okay, until I get my period, and now I'm breaking out again. I always breakout around my period. I hope it gets better. Maybe birth control pill will help my acne, but I don't want to take any birth control pills.",3.0,2010-08-13,2
153509,Doxycycline,Acne,"My doctor put me on doxycycline for my mild acne, and I saw very little difference. I was on it for two months, and still had scattered breakouts. I'm disappointed in the results, and the side effects. I got a yeast infection twice! If you take this, take probiotics with it, or you may end up with a yeast infection.",3.0,2013-02-05,13
16357,Ethinyl estradiol / norethindrone,Acne,"I'm 34 yrs old I've been on this pill for a little over 4 mo. I've never had really bad acne my entire life just the occasional zits here and there. I guess you could say I was lucky. When I started this pill I completely broke out on my forehead and still have tiny little pimples that will not go away. I also didn't realize it until now but, I've also had mood swings. I literally cry at the drop of a dime. Lastly, I also never really gained weight while I was on birth control again I guess I was lucky but, I've definitely put on some LB's. The ONLY thing that I like is my breasts are big and perky....",2.0,2016-02-05,1
63598,Epiduo,Acne,I have been on Epiduo for about 3 weeks and it seems like every time I apply the gel I turn red and breakout more. Then it's accompanied by dry flaky skin. I think I'm going to stop the use of the Epiduo gel.,1.0,2015-01-27,52
65279,Yasmin,Acne,"I have been on Yasmin for 6-7 months now. I was on Sprintec before (the generic of Otho Cyclen) but I switched over because I thought Yasmin would be better at not causing weight gain. I definitely haven't noticed much weight gain, and everything has been great except for my acne. I have never really had bad acne before going on this pill. Yasmin caused cystic acne all over my cheeks, chin, and along my mouth/jawline. I remember reading that acne in these areas are always to do with your hormones. I skipped my period for the past 1-2 months so I decided to take off and go on the placebo week. Now that its my 4th day off of it, my acne has gone down significantly and is even starting to fade. I'm seriously thinking of stopping this pill.",1.0,2016-09-28,5
124804,Tri-Previfem,Acne,"I am currently on the third month of this birth control, and will be ending it after the pack is finished. I originally went on this to clear my chin breakouts, which would not go away. My chin is now clear (with some scarring), but both of my cheeks have been breaking out on and off since I've started this. I would say the trade off for the clear chin is not worth it. I'm not sure if I've gained any weight, but I did experience some mild nausea. My periods were already consistent, and this did not change that. I would not recommend this to someone, unless they have very bad acne, because the initial breakout (which for me has refused to end) is probably much worse than what you are dealing with now.",3.0,2016-04-16,3
153548,Doxycycline,Acne,"My psychiatrist put me on this medication for treatment of acne. It worked for about 2 months after I was initially on it. Now it doesn't work at all. I have just as much acne as I did before even though I take it twice a day. I've tried topical creams too, but nothing helps.",2.0,2012-01-10,3
73792,Ethinyl estradiol / norethindrone,Acne,"First few months were fine, after 2 months I experienced mood swings, depression and the worst acne of my life which did not help with my depression at all!",1.0,2012-10-15,20
85715,Ethinyl estradiol / norgestimate,Acne,"I have only been on this pill for one cycle, but it seems as if my acne is worse. I was put on Trinessa solely for my acne and now I'm considering stopping. I have read reviews and the vast majority of those reviews mention a huge flare-up in their acne, just as I have, which makes me think that this isn't unusual. I really want to stick with it, but I'm not sure my self-confidence can handle it.",2.0,2014-03-23,20
132876,Loestrin 24 Fe,Acne,"If i could rate this a zero, I would. I have suffered with painful periods since seventh grade and finally went on the pill two months ago. I have had near perfect skin my entire life and my skin is so terrible now that even my mother who is the type to say it's not the bad is extremely concerned. My breasts are also extremely sore and I have been spotting so bad that I have to wear a pad, not even a pantie liner. My doctor is not even telling me to stick out the next month, I switching pills next week at the start of my next period. Do not do this to yourself, especially if you have clear skin to start with.",1.0,2016-12-08,2
179563,Adapalene / benzoyl peroxide,Acne,"I had mild acne and then took this because my doctor said accutane was too bad for me. After about 2 weeks my face was beat red and burned like crazy then I broke out like ten times worse than before and my whole face was covered and it was horrible. I stuck with it for like 2 more weeks and it just got worse. I switched to accutane and I'm 3 months in and my face is doing really well. I recommend accutane, I don't feel depressed and the only side effect I've gotten is dry lips.",1.0,2017-05-08,4
157879,Accutane,Acne,"Please think twice about this medication. I struggled with cystic acne from middle school until now (I'm 35). I took Accutane and it cleared up my skin for several years. It does seem like a miracle pill and the results were impressive. However, the side effects listed are REAL and can happen years after taking the medicine. It is not worth it. I was diagnosed with colitis and that is way worse than having bad skin. I wish I had never taken Accutane because now I will have to deal with stomach pain, bleeding, diarrhea and taking medication for the rest of my life.",3.0,2011-08-07,33
153524,Doxycycline,Acne,"It was fine at first, but about halfway through the month it gave me intense nausea, so bad I couldn't go to work or even stand up without throwing up/dry heaving. It wasn't even great for my acne. It stopped a little bit of my acne (bad flareups) but I still had constant pimples all over my chin. At pretty much the same rate as I'd had before.",2.0,2012-11-13,15
81339,Yaz,Acne,This is the worst pill ever! It broke my entire face out. It made my acne sooooo much worst. I'm so upset with what has done to my face. I wish I didn't go on this pill at all seriously don't do it. It's so awful.,1.0,2015-11-15,9
202049,Benzoyl peroxide / clindamycin,Acne,"The first time I used Duac it was very effective, no irritation or symptoms after using it but a bit dry on affected areas. After a while I stopped using it as my skin was fine, when my acne came back I began to use it again after about two weeks. The morning after applying it my skin came out in large red blotches around affected areas, and it burned, was extremely itchy and it was dry. I have tried to using it now again since a month of not using it again and the same has happened, won’t be using this product again.",4.0,2017-11-09,2
46829,Clindamycin,Acne,I got this and was using it twice a day for 3 days. All my big breakouts stopped but it seemed like they were replaced with tiny ones.,1.0,2013-11-10,56
180031,Adapalene / benzoyl peroxide,Acne,"Last year I stared using this. I used it for about 2-3 months maybe even more but it didn't make much of a difference. But I guess everyone's skin is different, it may work for some people and not for others.",4.0,2013-09-19,6
73890,Ethinyl estradiol / norethindrone,Acne,"My acne got so bad and my skin even started peeling. Its caused so many problems and after trying this for 2 months and reading all these (mostly negative) reviews, today is my last day taking this pill.",1.0,2012-04-15,18
111805,Gianvi,Acne,"I was prescribed this to treat acne, PMDD, and amenorrea, however it did nothing to treat any of those things. Instead it made about 95% of face break out in cystic acne (you have seen proactive commercials), caused severe depression and panic attacks (I didn't have the motivation to do anything besides workout and then sit on the couch all day in sweat pants--often crying off and on), prevented me from getting a job ( I had just graduated with my Masters and obtained my RD license and I was so depressed with such cloudy thinking I could not portray myself in a way that would make someone want to hire me), and I had breakthrough bleeding every month during the second week of pills. I will NEVER take BC pills again!",2.0,2015-11-12,4
202116,Benzoyl peroxide / clindamycin,Acne,Would not recommend this. I was recently proscribed by my dermatologist by using it every evening. I used it once and the next day my entirw face was red and itchy. I heard that the irritated skin lasts for a few days. Not only does it barely help my acne condition but its embarrassing and ridiculous to have to walk around with my face completely red.,1.0,2015-11-11,5
153243,Doxycycline,Acne,"I was prescribed it along with a few creams for acne, I stayed on it for 2 years with no success. I realized when I stopped taking it the acne went away on it's own, I've had a fairly clear face (except for scarring) for the last 2 years now. Also, watch out for how long your in the sun with it, my doctor didn't tell me about it but prolonged exposure to sunlight can mess with your hair. It thinned mine out a lot, but I've heard this also could be done from a hormone imbalance from the medication and the fact that you still go through hormone imbalances and all that until your 21. Overall, I wouldn't recommend it, just exercise a little more and eat a little less dairy and it'll clear up better than any meds will.",4.0,2015-12-13,1
218527,Tri-Sprintec,Acne,"Please please read !!!! When I was younger my skin was good I would get a pimple here and there as a common teen, but later I broke out not bad don't get me wrong but I broke out on my cheeks, a lot on my forehead. I would have tiny skin coloured bumps , they would go and come back here and there , so my cheeks I usually have got like at least 6 zits on them , my skin is soft but I have red spots all over my checks. Anyway so let's get into tri sprintec I had gone to my Dermatologist and he prescribed me some ointment and some sensitive skin facial cleanser and now I had been prescribed tri sprintec and let me tell you worst experience EVER!! I only last 2 days !!! Headaches and vomiting ! Lost 12 p",1.0,2017-09-26,0
137028,Isotretinoin,Acne,"don't risk it, it's not worth losing yourself in the process of clearing your acne.",2.0,2016-04-01,14
157194,Differin,Acne,It started to help in the beginning then a month later I got the worst breakouts.,2.0,2012-01-06,21
218518,Tri-Sprintec,Acne,"I used to only get a pimple here and there on my cheeks. When I started Tri-Sprintec my acne got significantly worse. I was getting deep cystic zits all over my cheeks. After 3 months or so my acne calmed down but it was still worse than before. A year later and my acne is still worse than when I started the medication but I'm terrified to go off of it because I'm scared of the breakout that will happen when I go off of it. Wish I never started taking it, it's ruining my life.",1.0,2017-11-05,1
63646,Epiduo,Acne,"I'm using Epiduo, and its already on my 3rd month. And it's not that effective. My pimples are still there. I also suggest use sunblock in the morning so that your face won't burn.",3.0,2014-08-02,6
137062,Isotretinoin,Acne,"Had moderate acne for 10 years and tried just about everything: BP, topical/oral antibiotics, retinoids, spirono, birth control, etc. and my skin was very oily to top it off, making my acne practically undefeatable. Last year I developed horrible cystic acne on my chin and my derm urged me towards accutane. Well I can tell you it's caused the worst breakout ever on my cheeks: painful, blistering nodules connected deep under my skin. I got prescribed prednisone and azithromycin for that, but it didn't help. I have to take benzaclin now and my face has never been this dry, painful, and red. I'm going into my 4th month with horrible skin and things are looking bleak. The only good thing that's happened so far is that my blackheads are gone.",4.0,2015-11-09,3
135031,Dapsone,Acne,Was prescribed aczone to use once my skin was already mostly cleared by dermatologist. It made me break out all over in tiny little bumps. It was terrible and took months to get rid of.,1.0,2016-10-01,10
124719,Tri-Previfem,Acne,"Originally started as a means to treat cystic acne and alleviate period cramps. Anxiety runs in my family, but I've never had it severely until I started taking this birth control. It's been three months and a few days into the fourth pack, and I've had enough. I went from someone who's never broken down about last minute assignments to someone who cries everyday for no discernible reason and can't manage even the simplest classwork. I also started off completely fine with my FWB, but now I've become dependent and paranoid even though he's one of my closest friends and I never had these issues before. It's like I'm a different person entirely, and I hate it.",2.0,2016-11-29,2
84415,Ethinyl estradiol / norgestimate,Acne,"Took this for a year with no problems or side effects. It was amazing. I stopped taking any form of birth control for about two years. I took this again for a year and that's where all the problems came from. I started breaking out more and more each month. I had a rash along my hairline, my jawline, my back, my cheeks. It was terrible. It clears up a little during the ""fake"" pills week, but it's the worst acne I've ever had. I stopped taking it for 2 months and my face cleared up, so I knew it was the pill. I'm looking to switch to something new asap.",3.0,2016-12-01,3
132893,Loestrin 24 Fe,Acne,Omg...I'm so glad I read these reviews. Started to breakout immediately after the first week. White pimples and cystic ones on my chin and around my nostrils. I'm so embarrassed never had acne problems my face even hurts from the breakouts. Yesterday was my last day of taking it.,1.0,2016-04-20,4
15928,Ethinyl estradiol / norethindrone,Acne,"I never really had acne until I started this birth control. Now my skin is absolutely awful. I heard you have to wait three months for the hormone levels to stabilize and see improvement, but I've been on it for five and my skin only keeps getting worse.",1.0,2016-07-21,1
179587,Adapalene / benzoyl peroxide,Acne,I'm a young teenage girl and I've struggled with acne since 6th grade and like any other young girl want to have a clear completion so I looked into acne treatments and found good review on epiduo so I went to my dermatologist and she said it was good to start and so I slowly progressed epiduo into my acne routine I used it for about 4 days and I saw progress in my acne being reduced in redness and size. I was thrilled. A few days later I went onto spring break and decided not to wear makeup and I realized around my mouth and wherever I put the epiduo gel was really red a day later after that my skin legit started to peel off my face. I stopped using it and it won't go away. HELP!!!!,1.0,2017-03-17,1
179538,Adapalene / benzoyl peroxide,Acne,About 3 months ago I started using the cream every night & the first few nights it burned then my face peeled for 2 weeks after that but my face hasn't cleared up and I still get big cystic pimples but my blackheads are starting to go away.,4.0,2017-07-26,0
84322,Ethinyl estradiol / norgestimate,Acne,"Terrible pill. It was recommended to me FOR my acne and made it worse. Also, be ready to cry ALL THE TIME for no reason at all.",1.0,2017-01-04,4
74454,Ethinyl estradiol / norethindrone,Acne,"I'm glad to hear that I'm not the only one who is having a horrible break out because of this pill. I've been taking it for 1.5 months, and my face, chest and back started to break out. In addition, it is very expensive. The one positive thing I did experience, is no bad headaches during my period like I used to get with other pills. Will go back to another pill that doesn't cause me these bad breakouts.",1.0,2010-04-13,13
135025,Dapsone,Acne,"I am so disappointed in this product I was hoping that it would help. I tried 2 different strengths but nothing worked. I stuck it out for a month and it just seemed to get worse and worse. I had cystic acne pop up in areas that I never had before. I also suffer from cystic acne and mine was pretty much cleared up, except for a few small areas. The affected areas got much worse and new areas started to pop up. My skin looks scarred and now has to heal after using this product. Everyone is different, so possibly it's just me. I do have Lupus, so this may be a factor. I definitely don't suggest it if you have sensitive skin. I have Cigna and met my pharm deductible this year but CVS wanted to charge $200 and Vons Pavilions covered at 100%.",1.0,2016-11-22,6
137089,Isotretinoin,Acne,"Horrible side effects (virtually all the ones listed) and did not cure my acne. In fact, it made my acne about 10 times worse than before. I find it strange that an ""initial breakout"" could last well over a month and be continuing to get worse, leaving scars that I never would have otherwise had. This drug was a total disaster for me and I stopped after a couple months. My face is still not back to how it was (which would be comparatively awesome and I had moderate-severe acne before), and to be perfectly honest this was the worst decision I could have made for my health and emotional wellbeing.",1.0,2016-03-08,18
180813,Solodyn,Acne,I'm 32 years old and I was suffering from unwanted blemishes constantly. I was desperate to try anything to clear my skin - my last straw was seeing the dermatologist. I've now been on Solodyn for 3 months and my skin is nearly flawless with a small blemish rarely. Unfortunately my trade off for clear skin seems to be weight gain from Solodyn. I have been the same weight my entire life no matter what I ate. But since one Solodyn I have gone from 155 pounds to 170 pounds in 90 days and I'm even starving myself. Has anyone else had this side effect? and if so I hope the weight drops when I stop taking them. Help!,9.0,2016-11-02,15
153118,Doxycycline,Acne,"I LOVE Doxycycline for acne. It is the only thing that gave me clear skin. I wish I was okay with taking it daily for the rest of my life. But taking any antibiotic long term is bad for both the body and environment. I did for vanity purposes, take doxycycline for a year. My skin looked AMAZING the entire time I was on it. When I quit taking it, all my adult acne came back. If you are considering it for acne, I can you it was incredibly effective. My face misses it greatly. I started out taking 100 mg in the am and 100 mg in the pm. That upset my tummy, so I went down to just 100 my once a day and it worked great.",10.0,2016-02-24,19
157907,Accutane,Acne,"I'm 16 and currently beginning my second month of accutane. Before I started my acne was hardly severe, but it was there and I wanted it gone. During the first month my acne became the worst it had ever been, but I wouldn't give up and it gradually began to clear up. I've experienced no severe side effects other than dryness everywhere. I now have about as much acne as I did when I started the treatment but I'm hoping in a few months the results will be worth it.",7.0,2010-12-13,2
161477,Ortho Tri-Cyclen,Acne,"28 yr old- healthy/active nurse. Always had minor acne since college but nothing like what I had a year ago last summer (2011). I blame it on YAZ for messing up my hormones. Painful cystic acne covered my jawline and forehead. I'm talking like 20 cysts at a time. Tried every OTC washes, organic, no caffeine, sugar, dairy, you name it. Nothing worked. Even though I did not want to go on the pill, I had too. ORTHO TRI CYCLEN (no the generic) for almost 7 months and finally it's almost clear. It was BAD first few months but I stuck with it. Give it time. PS: Generic is NOT the same as the real thing. Different fillers causes different reactions!",9.0,2012-05-15,60
77602,Cephalexin,Acne,"I have been getting these painful boils under my arm since I was 15-16. Now I'm 21. Like a month after I had my baby, my face broke out really, really bad. Cephalexin(Keflex) cleared it right up. I don't get boils any more.",8.0,2013-08-23,18
137315,Isotretinoin,Acne,"My son went on Isotretinoin for 6 months. He took 30 mg/ day for the first month and 60 mg for the next 5 months. He tried every other acne medicine and nothing worked until he started isotretinoin. His acne was clear by the third month. He had very dry lips and dry skin. The worst side effects was joint pain. He was 15, a runner and soccer player. It got to the point where even with ibuprofen, he was unable to play soccer or run track without a lot of pain. This is a hard price to pay for a high school athlete, and yet, now his skin looks great. The dermatologist has told us it is likely he will have 2 clear years and then he may have to start over again. I look back at before pictures and am so grateful this medicine was available.",10.0,2012-08-27,1
10729,Spironolactone,Acne,"This past summer I experienced the worst break out I've ever had all over my entire face. Never before had that happened- I just had a few cystic nodules around my mouth. For a month I tried everything- are a very strict diet and stayed away from bad carbs and sugars. Nothing worked. After seeing my dermatologist and gynecologist and doing research of my own I presented them with what I believed to be Polycystic Ovarian Syndrome. They did blood work and confirmed. The dermatologist wanted to put me on Accutane but I didn't feel good about it. I did more research, found out about spironolactone and asked him if this could be a good alternative, he agreed and I've been on 100 mg for about two months now. It has Changed my life. Gave me back confidence.",9.0,2014-12-09,36
157872,Accutane,Acne,"Have used Accutane and/or Claravis for a few cycles and experienced incredible results. Skin started clearing up within 4 weeks. By the 7th week, skin was completely clear from any redness, or new breakouts. I've tried everything available over-the-counter and other prescription antibiotics for my type of acne and although they would work for a while, the acne kept coming back. Accutane is the only thing that has ever worked for me.",9.0,2011-11-15,7
12259,Acanya,Acne,"I have been using Acanya for a little over a week and love it. I love that it doesn't dry my face, but my skin has shown vast improvement. I should have seen a dermatologist a lot sooner.",9.0,2009-11-21,6
153389,Doxycycline,Acne,I get the occasional painful cyst-type acne (I am in my mid 20's and this is a recent development). I have pretty sensitive dry/normal combination skin and other treatments I have tried have just made me peely and flaky. I have been using Citrus Clear Control products for a month. At first the treatment was a little drying so I went to using it every other night and now I am applying it every night following it up with the moisturizer. My skin is DEFINITELY clearer. It is still a little irritating every once in a while but I have not had any peeling/redness. It definitely stops the cyst-type acne from coming back.,8.0,2014-02-25,6
24280,Tretinoin,Acne,"I'm prescribed Avita along with clindamycin phosphate and these products are the ONLY products that's able to clear my skin. In addition my skin is left with a luminous glow, texture and dark spots are cleared also. My skin is extra soft too, and though I'm only 18 and do not have wrinkles, I get 0% of its presence (due to dry skin usually left with expression lines. However with the use of this medicine I don't).",10.0,2010-04-27,14
