review_id,drugName,condition,review,rating,date,usefulCount
146956,Alprazolam,Anxiety,"Xanax simply stops to work when taken too long on a daily basis. At that point, one reaches ""tolerance,"" and the medication is simply no longer effective at that dose. Many psychiatrists tend to keep prescribing Xanax and other benzodiazepines at this point (strong, addictive tranquilizers that lead to dementia and Alzheimer's) as maintenance meds. It is then up to you to realize how bad they are and wean yourself off them, going through years and years of dangerous withdrawal. The best solution is don't even start! XANAX: NOT EVEN ONE!",1.0,2015-12-02,25
204572,BuSpar,Anxiety,"I started Buspar four days ago, and my anxiety is unbearable now. I suffer from severe migraine which has gotten worse since the first dose. Since it's only been days maybe I will try one more week to see if my anxiety gets better but from the looks of it I doubt it.",2.0,2011-01-15,11
140999,Escitalopram,Anxiety,"Worst med I ever put in my body. Used to take Paxil 20mg on and off for 9 years and dumbly thought I could try another pill only in case I tried to have kids. And wow worse side effects, insomnia, migraines. I was a hypocondriac and this med caused me to have depression and suicidal thoughts! Did NOT suite me at all. But everyone is different.",1.0,2016-02-19,2
196782,Paroxetine,Anxiety,"Here is my experience with 10+ years of taking Paxil. It did a good job controlling anxiety in combination with Lorazepam 4x daily. But there was a huge cost to taking Paxil. I gained 10lbs for every 10mg of Paxil I took for a total of 40lbs gained slowly over years. Also, erectile disfunction became a problem. Finally, about 2 years ago, because of insurance change, I had to change psychiatrists. My new psychiatrist asked me if I had noticed side effects of weight gain and sexual dysfunction while on Paxil. I had no idea my weight gain was related to Paxil. He weaned me off Paxil an on to Prozac. I lost 40 lbs in 6 mos without trying. Prozac works just as well with my anxiety. Perhaps Paxil isn't the right choice for some people.",1.0,2017-05-27,20
160722,Buspirone,Anxiety,"After being on Zoloft for a while and trying hydroxyzine, which both did nothing for my anxiety, Buspar has also had no effect whatsoever after almost a month. Still taking 100mg Zoloft but might stop taking the Buspar. I see no reason for putting another useless chemical in my body.",1.0,2012-04-14,17
140970,Escitalopram,Anxiety,"I took Lexapro for almost 4 weeks and quit because it was pure hell. I tried to push through the side effects but they never went away. Insomnia, couldn't eat, anxiety hit the roof, panic attacks every night, and crazy thoughts. Was not for me.",1.0,2016-03-30,21
160207,Buspirone,Anxiety,"I was put on this medication for anxiety and man do I regret it. I have only taken this medication for one day and cannot stop vomiting. I have the sweats, my skin is clammy, I'm very dizzy, I am very weak. I have tried eating chicken noodle soup and sipping on a Powerade and I can already feel that wanting to come back up! No way will I continue this! It may work for some but I can't even make it past day one...",1.0,2017-10-05,2
75281,Vistaril,Anxiety,I have tried so many things for my anxiety...Vistaril for anxiety did not help me personally...I know everyone is different but this did not help me at all. I just started Buspar for my anxiety so I am hoping this helps. But Vistaril did NOTHING... I didn't feel anything it may work for certain people but absolutely nothing happened with my anxiety decreasing ...,1.0,2017-07-01,15
140873,Escitalopram,Anxiety,"I was told by my psychiatrist to try lexapro 10 mg for my anxiety. I have tried other medications in the past to help with it like Wellbutrin and Zoloft. They didn't help at all I got side effects right away like nausa,headaches and dizziness. So I was hoping that lexapro would help where the others didnt. I kept a positive attitude in hopes that it would make me have less anxiety. I took my first pill and 2 hrs later I felt so nauseous that I had trouble standing up without wanting to vomit. Then I starting feeling like my scalp was on fire. Also parts of my skin felt like it had a burning sensation. It didn't go away for the rest of the day. The next day I tried again and the same thing happened I wondered if with EDS if I can't take it",1.0,2016-05-19,2
186228,Desvenlafaxine,Anxiety,"The first few weeks were not pleasant but soon after the Pristiq started to help regulate my mood, it made me less likely to be anxious angry or sad. Basically it made me not really care...about much of anything. It did help me leave a bad relationship which I believe was the source of much of my anxiety. 3-4 months in and I an now growing tired of feeling so ""blah"" all the time...I am planning to taper after the Thanksgiving holiday so hopefully I am back to normal around mid December. I am not looking forward to the discontinuation symptoms - i.e. withdrawals.",4.0,2012-11-14,20
28192,Lexapro,Anxiety,I started 10mg lexapro 5 days ago for anxiety. I had been free from mirtazapine for about 9 days before starting. At first I though I had a tummy bug and stayed in bed the next day.... 5 days later and I'm still in bed and yesterday spoke with my doc who said to stop taking them. I was a complete nervous wreck... more than I had ever been without meds. Neither of the previous 2 meds (paxtine and mirtazapine) had side effects like this. This med is not for me sadly.,3.0,2015-07-06,18
75275,Vistaril,Anxiety,"I’ve had severe anxiety my whole life but was never put on anything till about 7 months ago. I was also diagnosed with bipolar, so when I’m manic and having a extremely hard time falling asleep this medicine works. But for my anxiety, which it was prescribed for, doesn’t do anything except make me pass out and not want to do anything for days! It also makes me fall asleep at the drop of a dime, for example while driving! This may work for others, but it’s definitely not the pill for me when it comes to anxiety, though for when I need to get some shut eye it works great!",4.0,2017-09-26,6
182990,Cymbalta,Anxiety,This medications helped with my arthritis a little but did nothing for anxiety,1.0,2015-05-08,24
160437,Buspirone,Anxiety,"I really wanted this to work! Buspar (5mg twice daily) was added to my Wellbutrin to help with anxiety. Immediately noticed mild insomnia, incredibly vivid and intense dreams when I could sleep. Daily diarrhea, bloating, and bouts of vertigo. I made it 4 weeks without improvement in side effects and was forced to discontinue.",2.0,2016-03-30,11
132214,Ativan,Anxiety,"Highly addictive medicine. Very angry I was put on this. I have worse anxiety and hand, feet, and head tremors. Docs give out benzos too easily. Then they do not want to help you get off them. It is awful. They treat you like a pill seeker instead of slowly weaning you off. More doctors need to use the Ashton Method of withdrawal. Taking someone off benzos too quickly can induce anger, crying spells, depression, and even seizures. Too many doctors do not want to help patients get off these pills and it is wrong.",2.0,2015-12-05,47
225802,Bupropion,Anxiety,"I was put on 150 mg dose about 4 weeks ago for mild depression/anxiety. I had dry mouth, headaches, spacey feeling, and nervousness. All of which added to my anxiety. I switched to 300 mg for 1 week, but the jitters increased and I could have climbed the walls! Rarely felt like eating. It did not negatively affect my ability to orgasm (like Lexapro did) which was nice, but couldn't handle the side effects. Trying Cymbalta.",3.0,2011-04-27,37
141953,Escitalopram,Anxiety,"I have heardof this drug working well for others. However, I feel compelled to write my experience with this drug. I was given a four week supply of Lexapro by my doctor (10mg pills) because I had panic attacks two days in a row which I did not realize at the time was a result of over drinking. I ended up taking two pills total. The side effects I experienced were: EXTREME anxiety, nausea, headache, chest pains, cold sweats, sleeplessness, nervous energy, and just general mania. I was terrified that this would never go away. The side effects went away the fourth day after taking the second (and last) pill. That was however the worst and longest 4 days of my life. You WILL get through this!",1.0,2009-10-20,26
28143,Lexapro,Anxiety,"Been on Lexapro for 2 days. Horrible nausea, headache. My husband asked the pharmacist about help with this. She recommended an over-the-counter liquid called Ematrol. Used by children and adults. It helped. Also sipped ginger ale as needed. Feel very out-of-body, shaky but trying to stick it out as everyone seems to say the first day/week is hell, but then all is good. Am continuing on Klonopin, per my psychiatrist's recommendation, until the Lexapro kicks in. Will try taking it at night, as this seems easier to ""ride out"" the side effects through sleep.",2.0,2015-08-16,24
177310,Duloxetine,Anxiety,"By the third dose, I had experienced chest tightness, dry mouth, dilated pupils, dizziness and a loss of emotions. The most interference in my life was the dizziness. I did not want to drive the 25 miles to work and back due to feeling dizzy. The side effect that bothered me the most was the lack of feeling emotions. I felt very detached from any emotion and was unable to cry, laugh or feel love. I discontinued the drug after the third dose. This was not the way I wanted to feel while dealing with moderate anxiety. I'll look for herbal remedies and remain in therapist-guided talk therapy. I don't want to be a dizzy emotional zombie. I am also scared to death, from what I've read, to discontinue this drug due to horrendous bad side effects.",1.0,2017-01-03,24
121010,Venlafaxine,Anxiety,"this drug causes fluid retention in breasts in men, also it gave me serious constipation it was terrible, bloated belly, maybe it gave me slight hangover like feeling next day after I took it this drug gave me manic episodes and withdrawal was terrible, I would never recommend this drug to anyone Went to my doctor he prescribed some medicine for constipation, I used it for a week and it was the terrible week, after that, I stopped taking it .Docs cannot do much but self-learning can",1.0,2017-03-28,7
146807,Alprazolam,Anxiety,Please try a different benzo before this drug. It's a life ruiner. The effects are so strong and leave the body quickly it makes you crave more. Tolerance builds like crazy with this drug too. I suggest klonopin. It works great and lasts a lot longer. Withdrawal is horrible from Xanax. You can die from it. Also comes with severe memory loss while taking it.,2.0,2017-03-21,25
184409,Hydroxyzine,Anxiety,"My first review on here. Prescribed 25mg to be taken during an anxiety attack. Took it twice, once at night and once during a morning spell. It didn't do anything good but it didn't do anything bad either. From the rest of the reviews, it looks like it either works great or not at all. There doesn't seem to be much harm in trying.",1.0,2014-02-13,53
204551,BuSpar,Anxiety,Made me very dizzy and lightheaded.,4.0,2011-10-14,12
204632,BuSpar,Anxiety,I tried it for anxiety and aggresive behavior. With in a few minutes of taking the first dosage I became catonic. Tried again two more times and each time the same thing; Dr. changed my medication after that and said that happens in a very few patients on Buspar.,1.0,2012-02-13,12
168639,Vilazodone,Anxiety,"I tried this for anxiety, but unfortunately it killed my stomach and I had to stop after 2 weeks. Upon the first dose, I became very nauseous. I moved the dosing time to after my largest meal, but it did not help. My stomach would cramp for 3 hours after taking the pill. It gave my heartburn also. I had zero appetite and could not even think about eating a vegetable for all 14 days. I could only eat very bland foods in very tiny amounts. I have gastritis and this drug flared it so badly, I had to take Prilosec. If you have stomach/GI issues of any kind, I would not suggest this drug. I would also advise you check with your insurance on the cost. I was given a sample pack, then called my insurance and it was going to be $223/month for me.",1.0,2017-03-09,3
184574,Hydroxyzine,Anxiety,I've been taking Vistaril 25 mg for 3 weeks and it has not helped me what so ever. At first I felt a little less nervous but when I had to go to an assembly it kicked right back up! Now I'm getting ready to get on Lexapro. Hopefully this drug works for me.,3.0,2009-05-19,17
141157,Escitalopram,Anxiety,"I have panic attacks and anxiety. My doc prescribed 10 mg of teva-escitalopram. I tried taking this medication about a month ago and was soo sick by day 2 I quit. I just had a bad panic attack on the weekend so I decided to start taking this medication again, this time I broke the pill in half. I'm now on day 4. My anxiety seems a bit worse because now I'm scared. I'm dizzy, I have diarrhea, I get bad head aches, I'm freezing right now and I just threw up a little bit. Is this normal? Every one says the first week is hellish.....like this? Thanks!",1.0,2015-09-03,2
160303,Buspirone,Anxiety,"My doctor put me on this medicine on 2-17-2017 twice a day at 7.5mg for my anxiety and stress levels. Today is 2-20-2017 and I'm already having issues. I ended up getting extremely light headed, heart racing, sweating, and dizzy all in the matter of five minutes. I went to go to the bathroom so I could try and feel better. Next time I remember I was on the floor laying in a pool of my own vomit. At that time, I had no idea what was going on, what had happened, or anything. I ended up having a bad seizure. I was locked in place for five minutes, not breathing properly, and throwing up everywhere. I was extremely confused and exhausted like I had just ran a marathon. Went to bed and had another one six hours later.",2.0,2017-02-20,9
172220,Clonazepam,Anxiety,I've been on this med for 2 months it keeps me awake all night..what to do I take it at bed time .Still awake at 4 am,7.0,2017-10-13,4
147036,Alprazolam,Anxiety,"I was originally just on the regular XANAX for year's and at first it helped and then it wore off and wasn't affective. My Doctor searched and searched for another medication that would be very effective especially because I have ""LUPUS"" and have been having severe anxiety and depression I really had to be on something before I stressed my ""Lupus"" to flair up! So XANAX XR was recommended , and OMG this XR is so amazing and very effective. I absolutely love it! It helped with anxiety, depression and sleep! I t works wonders and I totally recommend it to anyone.",10.0,2015-06-16,75
30079,Klonopin,Anxiety,"I have anxiety disorder and ocd which has made me depressed over the years. I have tried various SSRI's and some antipsychotics, none of which seemed to help with my overwhelming anxiety obsessional thoughts and compulsions. They also gave me unwanted side effects. I am very scared when it comes to taking medication, and will only take a pill if i really need too. The only thing that seems to help in easing my mind is Klonopin! I have no noticeable side effects from taking it . It makes me feel like my old self, helps me to be focused and relaxed, and gives me the confidence to do more things. I would definitely recommend this medication for other anxiety sufferers out there.",9.0,2015-02-15,31
147514,Alprazolam,Anxiety,"I am a recovering alcoholic, now 23 years sober but have had to relent and begin taking alprazolam for general ongoing mild anxiety which affects my sleeping which in the past had been very normal. I take one half of an oval pill and then one half of an Ambien for sleep and it has worked great. No side effects. Of course I am concerned about addiction but I am against the wall on a remedy and I am committed to a limit on my alprazolam and Ambien.",8.0,2009-11-15,2
168684,Vilazodone,Anxiety,"I am a man and I started Viibryd primarily to reduce the sexual side effects of other SSRI's. I have tried many different SSRI's over the years for generalized anxiety and until now Zoloft was the best choice for me. I tend to be sensitive to medications and am usually affected by side effects, but at the same time I usually respond well to lower dosages. I personally had severe side effects including vertigo, and watery diarrhea. All the side effects passed after a couple of weeks and increasing the dosage had little effect on me. Currently on 20mg and staying there. My libido has improved significantly and I am very happy with the results. Side effects were brutal, but worth working through them!",9.0,2016-02-11,9
196855,Paroxetine,Anxiety,"I went on this medication due to me having severe anxiety and mild OCD to the point where it affected me in almost every aspect, I've only been on it for almost a month and so far the results have been amazing, the only side effect that I've really noticed is the fact that I get sleepy so I take it before bed. Other than that I'm more happy, more calm, my OCD isn't as bad anymore",9.0,2016-07-04,50
30220,Klonopin,Anxiety,"Used to take 2 mgs three times per day with my old doctor, stopped for a year, and now I'm on 0.5mg three times a day. I built up a tolerance quickly, but when I have a panic attack 4 mgs stops it dead. I love Klonopin, it lasts longer than Xanax and doesn't give me a crazy hangover feeling the next day!",10.0,2013-04-19,58
204655,BuSpar,Anxiety,I have been taking Buspar for almost a week. My doctor prescribed it for my Anxiety - mainly my constant agitation. I must say that I have been sleeping better and I feel somewhat better. I take Buspar 15mg - Once a day.,9.0,2008-06-18,184
174163,Valium,Anxiety,I have been on 10mg of Valium 3 times a day since 1998 and have had very good luck with it. I have tried other medicines but everything else seems to not work as well. Don't no what I would do if I didn't have it. I work 6 and 7 days a week. It doesn't affect that at all. I'm a lot calmer when I use it and still full of energy.,10.0,2011-01-11,70
183221,Cymbalta,Anxiety,"Cymbalta changed my life. Initially, for the worst - I was vomiting and felt like I was dying for the first few days. Then gradually, the side effects lessened. The vomiting stopped after 2 days, the foggy head and ill stomach cleared after a week or 2. Then it changed my life for the better - to my shock and my doctor's amazement, the lowest dose (30mg) worked! No need to experience the side effects of moving to a higher dosage (thank goodness!). I was previously unable to socialise and frequently had a fight or flight response that was way over-reactive. Now, although not perfect, it's way more under control. I've used Cymbalta for almost a year. I would definitely recommend Cymbalta!",10.0,2013-04-23,123
146842,Alprazolam,Anxiety,"Xanax saved me. Apprehensive about taking meds but broke down after it got so bad I didn't even want to take the covers off my head with my eyes clenched shut just fearing every day because I knew anxiety, fear of everything under the sun and panic attacks would rule my day. I was told I needed to be on long term anxiety drugs so I tried lexapro and ended up in the er with side effects so horrific I don't even want to think of it now. Xanax is basically a quick fix to calm the anxiety but it's the only thing I'm willing to take and over time I broke out of the nightmare I was living. I still have bouts of anxiety but as long as I have Xanax on hand I know I'll be ok. I never had any bad side effects except for being tired. Trade is worth it",10.0,2016-08-15,35
147157,Alprazolam,Anxiety,"I have been on many other anxiety/panic disorder medicines. Tried Zoloft, Buspar, etc. Been on Xanax 1 mg 3x daily for about 10 yrs, but as my situations changed going to multiple panic attacks feeling as if appending doom due to attacks my doc has me on the 2 mg Xanax 3 times a day with diazepam (Valium) 10 mg 2x daily and Vistaril in between doses to prolong the medicine. I have seen my life do a big turn around! And I use Restoril a sleep aid to get me through the night because I would awake in the night with an attack. I understand these are benzodiazepines with the exception of the Vistaril. It's hard to find a doctor willing to accommodate that but it does work. Taken properly I have next to no attacks thanks to my understanding doctor. Only thing that works.",10.0,2013-09-14,12
83269,Paxil,Anxiety,"I do great when on this medicine but if I run out.. I feel nauseated, my head feels like it's swimming, I feel mad and snap easily. So don't run or stop without your Doctor's help. I see my Doctor today, I can't wait.",10.0,2011-05-31,18
176448,Lorazepam,Anxiety,"Severe social anxiety to the point of not being able to interact with people in public, couldn't go to seminar classes where speaking was required. Would sweat profusely with my heart beating out of chest. Now I take one 1 mg pill most days (not all) along with clonidine daily and I feel fine! I participate in lecture discussions, talk to people around me, etc. Side effects: a slight ""nodding"" effect"" and bit drowsy but I sort of like its cool breeze of sedation. Great medicine!",9.0,2014-01-14,31
160738,Buspirone,Anxiety,"I am a physician who has struggled with anxiety my whole life. I have previously tried selective serotonin reuptake inhibitors (SSRIs), benzodiazepines, as well as meditation, exercise, healthy eating, and CBT. All the non-drug options were helpful but not sufficient. SSRIs were not very effective in my case and I had various side effects. Benzodiazepines worked brilliantly and helped me through some stressful months of training but led to pharmacological tolerance and dependence. After many years of struggling with no medications I decided to try buspirone but I was very skeptical it would work because most of my colleagues stated it was a rather ineffectual drug. I have to say they are absolutely wrong. I feel calmer, more in control than I have been for a long time.",9.0,2011-07-08,35
141473,Escitalopram,Anxiety,"I am 23 years old and have been on Lexapro for 7 months for anxiety. I decided to come write a review because I remember when I was first prescribed Lexapro I was in a bit of a panic. I didn't know rather or not to take it and looked for as much information as I could. Most of the review I read were negative but I was in such a bad place that I chose to still give it a try. So, I want there to actually be a good review out there for people to see and read. I can say that Lexapro changed my life. My extreme anxiety is gone. I sleep normally and I feel like a new person. The only complaints I have, is that I am always tired and it KILLED my sex drive. Love it.",8.0,2013-11-23,24
214585,Escitalopram,Anxiety,"So I have been taking Prozac for a long time but I was always taking naps and tired, I didn’t want to do anything go anywhere. I decided to look into Lexapro reviews some of them really scared me. I thought why not give it a shot one of my cousins takes Lexapro. The doctor switched me from Prozac to Lexapro and I’m going on three weeks I feel so much better I have more energy I’m not sleeping all the time. I’m noticing more things that make me happy. I did have side effects in the beginning but they were very mild constipation dizziness tingly feelings but those are starting to go away. I’m so glad I try this medication I hope it continues to work for me. The doctor started me on 5 mg and I’m slowly working my way up to 10 mg. Write your reviews because people actually do read them.",10.0,2017-11-19,15
147320,Alprazolam,Anxiety,"It helps me from having severe anxiety attacks, I do go through normal emotions, so I only take them when I get too overwhelmed and I am going to have an anxiety attack. They are very helpful.",7.0,2012-03-21,18
160455,Buspirone,Anxiety,I have tried many other anxiety medications. This took about 4 weeks to work but is great. I'm 34 years old and have had anxiety since I was a teenager. This is the best I have felt in my adult life. Also taking Prozac once daily. Great combination.,10.0,2016-02-16,50
131758,Effexor XR,Anxiety,"I have been on this medication for over 6 years now, 150 dose although it does help quite a bit if you're forgetful like me and miss a dose you're going to be in a world full of trouble even one day will make you feel sick although I still get panic attacks now and then. I find it does really help.",8.0,2016-02-11,30
160206,Buspirone,Anxiety,"I've been on Buspar for two years. The drug does not 'kick in' quickly, but once it does start working, one notices a nice, quiet calm. (It started working for me after ~ 30 days. )It's nothing like the benzodiazepines (thank goodness) and does not make me feel like a zombie with memory problems like Clonazepam (Klonopin) or Valium, etc. I use this in conjunction with Cymbalta and this combination helps me with both anxiety and depression. The only side effect I notice is that I might sweat a bit more. It is non-addictive, but as with any drug used long-term, one become physically dependent upon Buspar and one should follow a withdrawal schedule formulated by your PCP.",9.0,2017-10-06,16
